번호,유형,대분류,소분류,요구사항 명세
1-1,기능,사용자 관리,로그인,일반 회원은 아이디와 비밀번호를 사용하여 로그인할 수 있어야 함.
1-2,기능,사용자 관리,회원가입,"새로운 이메일, 비밀번호, 이름 등의 정보로 회원가입할 수 있어야 함."
1-3,기능,사용자 관리,프로필 관리,자신의 프로필 정보를 수정하고 관리할 수 있어야 함.
2-1,기능,정보 검색,검색 기능,원하는 내용을 검색할 수 있는 기능이 필요함.
2-2,기능,정보 검색,음성 검색,음성으로 검색할 수 있는 인터페이스가 필요함.
3-1,기능,문서 관리,업로드,필요한 문서를 업로드할 수 있는 기능이 있어야 함.
3-2,기능,문서 관리,다운로드,저장된 문서를 다운로드할 수 있어야 함.
3-3,기능,문서 관리,파일 읽기,저장한 문서를 읽을 수 있어야 함.
4-1,기능,AI 모델,언어 모델 선택,다양한 언어 모델 중에서 선택할 수 있는 기능이 필요함.
4-2,기능,AI 모델,API 호환,OpenAI API 등 Open LLM API와 호환되어야 함.
5-1,기능,대화 관리,대화 저장,대화 목록을 저장할 수 있는 기능이 있어야 함.
5-2,기능,대화 관리,대화 내보내기,대화 내용을 PDF나 텍스트 파일로 내보낼 수 있어야 함.
5-3,기능,대화 관리,대화 공유,특정 대화를 다른 사용자와 공유할 수 있어야 함.
6-1,기능,음성 처리,STT (음성 인식),오디오를 입력으로 받아 텍스트로 변환하는 기능이 필요함.
6-2,기능,음성 처리,TTS (텍스트 읽기),생성한 텍스트를 오디오로 읽어주는 기능이 필요함.
7-1,기능,언어 처리,은어 번역,사용자가 입력한 은어를 표준어로 번역하는 기능이 필요함.
7-2,기능,언어 처리,다국어 지원,여러 언어로 입력 및 출력을 지원해야 함.
8-1,비기능,사용성,사용자 인터페이스,인터페이스는 직관적이고 사용하기 쉬워야 함.
8-2,비기능,사용성,반응형 디자인,다양한 디바이스와 화면 크기에 대응하는 반응형 디자인이 적용되어야 함.
9-1,비기능,성능,응답 시간,"응답 시간은 2초 이내여야 하며, 처리 속도가 빠를 것."
9-2,비기능,성능,확장성,사용자 수 증가에 따라 시스템이 원활하게 확장될 수 있어야 함.
10-1,비기능,보안,접근 제어,사용자 역할에 따른 적절한 접근 권한 제어가 이루어져야 함.
